{
  "applied": false,
  "applied_paths": [],
  "candidates": [
    {
      "candidate_id": "G-001",
      "classification": {
        "conditional_build": false,
        "plugin_entry": false,
        "production_path": false,
        "public_api": false
      },
      "evidence": [
        "git ls-files --others",
        ".ai-team/policy/gardening.json#safe_auto_patterns"
      ],
      "reason": "git 이 추적하지 않는 temporary_backup 패턴 artifact",
      "recommended_action": "delete",
      "risk": "low",
      "safety": "SAFE_AUTO",
      "status": "candidate",
      "target": {
        "path": "docs/.DS_Store",
        "symbol": null
      },
      "type": "temporary_backup"
    },
    {
      "candidate_id": "G-002",
      "classification": {
        "conditional_build": false,
        "plugin_entry": false,
        "production_path": false,
        "public_api": false
      },
      "evidence": [
        "git ls-files --others",
        ".ai-team/policy/gardening.json#safe_auto_patterns"
      ],
      "reason": "git 이 추적하지 않는 generated_garbage 패턴 artifact",
      "recommended_action": "delete",
      "risk": "low",
      "safety": "SAFE_AUTO",
      "status": "candidate",
      "target": {
        "path": "scripts/__pycache__/amplai_hook.cpython-311.pyc",
        "symbol": null
      },
      "type": "generated_garbage"
    },
    {
      "candidate_id": "G-003",
      "classification": {
        "conditional_build": false,
        "plugin_entry": false,
        "production_path": false,
        "public_api": false
      },
      "evidence": [
        "git ls-files --others",
        ".ai-team/policy/gardening.json#safe_auto_patterns"
      ],
      "reason": "git 이 추적하지 않는 generated_garbage 패턴 artifact",
      "recommended_action": "delete",
      "risk": "low",
      "safety": "SAFE_AUTO",
      "status": "candidate",
      "target": {
        "path": "scripts/__pycache__/amplai_hosts.cpython-311.pyc",
        "symbol": null
      },
      "type": "generated_garbage"
    },
    {
      "candidate_id": "G-004",
      "classification": {
        "conditional_build": false,
        "plugin_entry": false,
        "production_path": false,
        "public_api": false
      },
      "evidence": [
        "git ls-files --others",
        ".ai-team/policy/gardening.json#safe_auto_patterns"
      ],
      "reason": "git 이 추적하지 않는 generated_garbage 패턴 artifact",
      "recommended_action": "delete",
      "risk": "low",
      "safety": "SAFE_AUTO",
      "status": "candidate",
      "target": {
        "path": "scripts/__pycache__/amplai_runtime.cpython-311.pyc",
        "symbol": null
      },
      "type": "generated_garbage"
    },
    {
      "candidate_id": "G-005",
      "classification": {
        "conditional_build": false,
        "plugin_entry": false,
        "production_path": false,
        "public_api": false
      },
      "evidence": [
        "git ls-files --others",
        ".ai-team/policy/gardening.json#safe_auto_patterns"
      ],
      "reason": "git 이 추적하지 않는 generated_garbage 패턴 artifact",
      "recommended_action": "delete",
      "risk": "low",
      "safety": "SAFE_AUTO",
      "status": "candidate",
      "target": {
        "path": "scripts/__pycache__/amplai_supervisor.cpython-311.pyc",
        "symbol": null
      },
      "type": "generated_garbage"
    },
    {
      "candidate_id": "G-006",
      "classification": {
        "conditional_build": false,
        "plugin_entry": false,
        "production_path": false,
        "public_api": false
      },
      "evidence": [
        "git ls-files --others",
        ".ai-team/policy/gardening.json#safe_auto_patterns"
      ],
      "reason": "git 이 추적하지 않는 generated_garbage 패턴 artifact",
      "recommended_action": "delete",
      "risk": "low",
      "safety": "SAFE_AUTO",
      "status": "candidate",
      "target": {
        "path": "scripts/__pycache__/kit_distribute.cpython-311.pyc",
        "symbol": null
      },
      "type": "generated_garbage"
    },
    {
      "candidate_id": "G-007",
      "classification": {
        "conditional_build": false,
        "plugin_entry": false,
        "production_path": false,
        "public_api": false
      },
      "evidence": [
        "git ls-files --others",
        ".ai-team/policy/gardening.json#safe_auto_patterns"
      ],
      "reason": "git 이 추적하지 않는 generated_garbage 패턴 artifact",
      "recommended_action": "delete",
      "risk": "low",
      "safety": "SAFE_AUTO",
      "status": "candidate",
      "target": {
        "path": "scripts/__pycache__/loopv2.cpython-311.pyc",
        "symbol": null
      },
      "type": "generated_garbage"
    },
    {
      "candidate_id": "G-008",
      "classification": {
        "conditional_build": false,
        "plugin_entry": false,
        "production_path": false,
        "public_api": false
      },
      "evidence": [
        "git ls-files --others",
        ".ai-team/policy/gardening.json#safe_auto_patterns"
      ],
      "reason": "git 이 추적하지 않는 temporary_backup 패턴 artifact",
      "recommended_action": "delete",
      "risk": "low",
      "safety": "SAFE_AUTO",
      "status": "candidate",
      "target": {
        "path": "tests/.DS_Store",
        "symbol": null
      },
      "type": "temporary_backup"
    },
    {
      "candidate_id": "G-009",
      "classification": {
        "conditional_build": false,
        "plugin_entry": false,
        "production_path": false,
        "public_api": false
      },
      "evidence": [
        "git ls-files --others",
        ".ai-team/policy/gardening.json#safe_auto_patterns"
      ],
      "reason": "git 이 추적하지 않는 generated_garbage 패턴 artifact",
      "recommended_action": "delete",
      "risk": "low",
      "safety": "SAFE_AUTO",
      "status": "candidate",
      "target": {
        "path": "tests/__pycache__/test_active_proposals.cpython-311-pytest-8.4.2.pyc",
        "symbol": null
      },
      "type": "generated_garbage"
    },
    {
      "candidate_id": "G-010",
      "classification": {
        "conditional_build": false,
        "plugin_entry": false,
        "production_path": false,
        "public_api": false
      },
      "evidence": [
        "git ls-files --others",
        ".ai-team/policy/gardening.json#safe_auto_patterns"
      ],
      "reason": "git 이 추적하지 않는 generated_garbage 패턴 artifact",
      "recommended_action": "delete",
      "risk": "low",
      "safety": "SAFE_AUTO",
      "status": "candidate",
      "target": {
        "path": "tests/__pycache__/test_active_proposals.cpython-311.pyc",
        "symbol": null
      },
      "type": "generated_garbage"
    },
    {
      "candidate_id": "G-011",
      "classification": {
        "conditional_build": false,
        "plugin_entry": false,
        "production_path": false,
        "public_api": false
      },
      "evidence": [
        "git ls-files --others",
        ".ai-team/policy/gardening.json#safe_auto_patterns"
      ],
      "reason": "git 이 추적하지 않는 generated_garbage 패턴 artifact",
      "recommended_action": "delete",
      "risk": "low",
      "safety": "SAFE_AUTO",
      "status": "candidate",
      "target": {
        "path": "tests/__pycache__/test_apply_jobs.cpython-311-pytest-8.4.2.pyc",
        "symbol": null
      },
      "type": "generated_garbage"
    },
    {
      "candidate_id": "G-012",
      "classification": {
        "conditional_build": false,
        "plugin_entry": false,
        "production_path": false,
        "public_api": false
      },
      "evidence": [
        "git ls-files --others",
        ".ai-team/policy/gardening.json#safe_auto_patterns"
      ],
      "reason": "git 이 추적하지 않는 generated_garbage 패턴 artifact",
      "recommended_action": "delete",
      "risk": "low",
      "safety": "SAFE_AUTO",
      "status": "candidate",
      "target": {
        "path": "tests/__pycache__/test_apply_jobs.cpython-311.pyc",
        "symbol": null
      },
      "type": "generated_garbage"
    },
    {
      "candidate_id": "G-013",
      "classification": {
        "conditional_build": false,
        "plugin_entry": false,
        "production_path": false,
        "public_api": false
      },
      "evidence": [
        "git ls-files --others",
        ".ai-team/policy/gardening.json#safe_auto_patterns"
      ],
      "reason": "git 이 추적하지 않는 generated_garbage 패턴 artifact",
      "recommended_action": "delete",
      "risk": "low",
      "safety": "SAFE_AUTO",
      "status": "candidate",
      "target": {
        "path": "tests/__pycache__/test_authority.cpython-311-pytest-8.4.2.pyc",
        "symbol": null
      },
      "type": "generated_garbage"
    },
    {
      "candidate_id": "G-014",
      "classification": {
        "conditional_build": false,
        "plugin_entry": false,
        "production_path": false,
        "public_api": false
      },
      "evidence": [
        "git ls-files --others",
        ".ai-team/policy/gardening.json#safe_auto_patterns"
      ],
      "reason": "git 이 추적하지 않는 generated_garbage 패턴 artifact",
      "recommended_action": "delete",
      "risk": "low",
      "safety": "SAFE_AUTO",
      "status": "candidate",
      "target": {
        "path": "tests/__pycache__/test_cli.cpython-311-pytest-8.4.2.pyc",
        "symbol": null
      },
      "type": "generated_garbage"
    },
    {
      "candidate_id": "G-015",
      "classification": {
        "conditional_build": false,
        "plugin_entry": false,
        "production_path": false,
        "public_api": false
      },
      "evidence": [
        "git ls-files --others",
        ".ai-team/policy/gardening.json#safe_auto_patterns"
      ],
      "reason": "git 이 추적하지 않는 generated_garbage 패턴 artifact",
      "recommended_action": "delete",
      "risk": "low",
      "safety": "SAFE_AUTO",
      "status": "candidate",
      "target": {
        "path": "tests/__pycache__/test_control_plane.cpython-311-pytest-8.4.2.pyc",
        "symbol": null
      },
      "type": "generated_garbage"